{"generated_by":"scripts/recon_agents_frontier.py","reading_notes":["P0 means add or validate a local AGENTS.md before the next broad refactor.","P1 means inspect and usually add local guidance if the directory carries contracts, generation, runtime, or projection behavior.","P2 means inspect first; many docs/examples/templates do not need new AGENTS.md if existing local guidance already routes them well.","P3 means watch unless the directory starts carrying active rules or risky automation."],"repositories":[{"candidate_count":0,"checkout_state":"scanned","invalid_heading_agents":[],"kind":"public-route-map","missing_required_agents":[],"name":"8Dionysus","nested_validators_present":1,"non_canonical_heading_agents":[],"not_in_nested_validator_map":[],"semantic_validators_present":0,"top_candidates":[],"unvalidated_by_any_agents_validator":[],"validator_present":true},{"candidate_count":0,"checkout_state":"scanned","invalid_heading_agents":[],"kind":"constitutional-center","missing_required_agents":[],"name":"Agents-of-Abyss","nested_validators_present":0,"non_canonical_heading_agents":[],"not_in_nested_validator_map":[],"semantic_validators_present":0,"top_candidates":[],"unvalidated_by_any_agents_validator":[],"validator_present":false},{"candidate_count":0,"checkout_state":"missing","invalid_heading_agents":[],"kind":"knowledge-root","missing_required_agents":[],"name":"Tree-of-Sophia","nested_validators_present":0,"non_canonical_heading_agents":[],"not_in_nested_validator_map":[],"semantic_validators_present":0,"top_candidates":[],"unvalidated_by_any_agents_validator":[],"validator_present":false},{"candidate_count":1,"checkout_state":"scanned","invalid_heading_agents":[],"kind":"runtime-infrastructure","missing_required_agents":[],"name":"abyss-stack","nested_validators_present":1,"non_canonical_heading_agents":[],"not_in_nested_validator_map":[],"semantic_validators_present":0,"top_candidates":[{"decision":"add-local-agents","directory":"schemas","path":"schemas/AGENTS.md","priority":"P0","rationale":"schema edits are contract edits","repository":"abyss-stack","repository_kind":"runtime-infrastructure","score":108}],"unvalidated_by_any_agents_validator":[],"validator_present":true},{"candidate_count":0,"checkout_state":"missing","invalid_heading_agents":[],"kind":"host-machine-organ","missing_required_agents":[],"name":"abyss-machine","nested_validators_present":0,"non_canonical_heading_agents":[],"not_in_nested_validator_map":[],"semantic_validators_present":0,"top_candidates":[],"unvalidated_by_any_agents_validator":[],"validator_present":false},{"candidate_count":0,"checkout_state":"missing","invalid_heading_agents":[],"kind":"operator-companion","missing_required_agents":[],"name":"ATM10-Agent","nested_validators_present":0,"non_canonical_heading_agents":[],"not_in_nested_validator_map":[],"semantic_validators_present":0,"top_candidates":[],"unvalidated_by_any_agents_validator":[],"validator_present":false},{"candidate_count":0,"checkout_state":"missing","invalid_heading_agents":[],"kind":"personal-portrait-protocol","missing_required_agents":[],"name":"Dionysus","nested_validators_present":0,"non_canonical_heading_agents":[],"not_in_nested_validator_map":[],"semantic_validators_present":0,"top_candidates":[],"unvalidated_by_any_agents_validator":[],"validator_present":false},{"candidate_count":0,"checkout_state":"missing","invalid_heading_agents":[],"kind":"control-plane-sdk","missing_required_agents":[],"name":"aoa-sdk","nested_validators_present":0,"non_canonical_heading_agents":[],"not_in_nested_validator_map":[],"semantic_validators_present":0,"top_candidates":[],"unvalidated_by_any_agents_validator":[],"validator_present":false},{"candidate_count":0,"checkout_state":"missing","invalid_heading_agents":[],"kind":"goal-space-projection","missing_required_agents":[],"name":"aoa-dashboard","nested_validators_present":0,"non_canonical_heading_agents":[],"not_in_nested_validator_map":[],"semantic_validators_present":0,"top_candidates":[],"unvalidated_by_any_agents_validator":[],"validator_present":false},{"candidate_count":0,"checkout_state":"scanned","invalid_heading_agents":[],"kind":"technique-canon","missing_required_agents":[],"name":"aoa-techniques","nested_validators_present":1,"non_canonical_heading_agents":[],"not_in_nested_validator_map":[],"semantic_validators_present":0,"top_candidates":[],"unvalidated_by_any_agents_validator":[],"validator_present":true},{"candidate_count":0,"checkout_state":"missing","invalid_heading_agents":[],"kind":"skill-canon","missing_required_agents":[],"name":"aoa-skills","nested_validators_present":0,"non_canonical_heading_agents":[],"not_in_nested_validator_map":[],"semantic_validators_present":0,"top_candidates":[],"unvalidated_by_any_agents_validator":[],"validator_present":false},{"candidate_count":0,"checkout_state":"missing","invalid_heading_agents":[],"kind":"evaluation-layer","missing_required_agents":[],"name":"aoa-evals","nested_validators_present":0,"non_canonical_heading_agents":[],"not_in_nested_validator_map":[],"semantic_validators_present":0,"top_candidates":[],"unvalidated_by_any_agents_validator":[],"validator_present":false},{"candidate_count":0,"checkout_state":"missing","invalid_heading_agents":[],"kind":"statistical-measurability","missing_required_agents":[],"name":"aoa-stats","nested_validators_present":0,"non_canonical_heading_agents":[],"not_in_nested_validator_map":[],"semantic_validators_present":0,"top_candidates":[],"unvalidated_by_any_agents_validator":[],"validator_present":false},{"candidate_count":0,"checkout_state":"missing","invalid_heading_agents":[],"kind":"deprecated-routing-predecessor","missing_required_agents":[],"name":"aoa-routing","nested_validators_present":0,"non_canonical_heading_agents":[],"not_in_nested_validator_map":[],"semantic_validators_present":0,"top_candidates":[],"unvalidated_by_any_agents_validator":[],"validator_present":false},{"candidate_count":0,"checkout_state":"missing","invalid_heading_agents":[],"kind":"memory-layer","missing_required_agents":[],"name":"aoa-memo","nested_validators_present":0,"non_canonical_heading_agents":[],"not_in_nested_validator_map":[],"semantic_validators_present":0,"top_candidates":[],"unvalidated_by_any_agents_validator":[],"validator_present":false},{"candidate_count":4,"checkout_state":"scanned","invalid_heading_agents":[],"kind":"session-memory-layer","missing_required_agents":[],"name":"aoa-session-memory","nested_validators_present":0,"non_canonical_heading_agents":[],"not_in_nested_validator_map":[],"semantic_validators_present":0,"top_candidates":[{"decision":"inspect-then-add","directory":".github","path":".github/AGENTS.md","priority":"P1","rationale":"platform automation and workflow metadata are public contracts","repository":"aoa-session-memory","repository_kind":"session-memory-layer","score":84},{"decision":"inspect-then-add","directory":"generated","path":"generated/AGENTS.md","priority":"P1","rationale":"generated outputs should remain evidence, not authority","repository":"aoa-session-memory","repository_kind":"session-memory-layer","score":80},{"decision":"inspect-first","directory":"docs","path":"docs/AGENTS.md","priority":"P2","rationale":"docs may carry doctrine, but many docs do not need local law","repository":"aoa-session-memory","repository_kind":"session-memory-layer","score":58},{"decision":"inspect-first","directory":"examples","path":"examples/AGENTS.md","priority":"P2","rationale":"examples need public-safety and source-sync boundaries","repository":"aoa-session-memory","repository_kind":"session-memory-layer","score":54}],"unvalidated_by_any_agents_validator":[],"validator_present":false},{"candidate_count":0,"checkout_state":"missing","invalid_heading_agents":[],"kind":"agent-role-layer","missing_required_agents":[],"name":"aoa-agents","nested_validators_present":0,"non_canonical_heading_agents":[],"not_in_nested_validator_map":[],"semantic_validators_present":0,"top_candidates":[],"unvalidated_by_any_agents_validator":[],"validator_present":false},{"candidate_count":0,"checkout_state":"missing","invalid_heading_agents":[],"kind":"model-canon","missing_required_agents":[],"name":"aoa-models","nested_validators_present":0,"non_canonical_heading_agents":[],"not_in_nested_validator_map":[],"semantic_validators_present":0,"top_candidates":[],"unvalidated_by_any_agents_validator":[],"validator_present":false},{"candidate_count":0,"checkout_state":"missing","invalid_heading_agents":[],"kind":"model-formation-lineage","missing_required_agents":[],"name":"aoa-agon","nested_validators_present":0,"non_canonical_heading_agents":[],"not_in_nested_validator_map":[],"semantic_validators_present":0,"top_candidates":[],"unvalidated_by_any_agents_validator":[],"validator_present":false},{"candidate_count":0,"checkout_state":"missing","invalid_heading_agents":[],"kind":"scenario-composition","missing_required_agents":[],"name":"aoa-playbooks","nested_validators_present":0,"non_canonical_heading_agents":[],"not_in_nested_validator_map":[],"semantic_validators_present":0,"top_candidates":[],"unvalidated_by_any_agents_validator":[],"validator_present":false},{"candidate_count":0,"checkout_state":"missing","invalid_heading_agents":[],"kind":"knowledge-substrate","missing_required_agents":[],"name":"aoa-kag","nested_validators_present":0,"non_canonical_heading_agents":[],"not_in_nested_validator_map":[],"semantic_validators_present":0,"top_candidates":[],"unvalidated_by_any_agents_validator":[],"validator_present":false},{"candidate_count":5,"checkout_state":"scanned","invalid_heading_agents":[],"kind":"extra","missing_required_agents":[],"name":"aoa-instagram-connector","nested_validators_present":0,"non_canonical_heading_agents":[],"not_in_nested_validator_map":[],"semantic_validators_present":0,"top_candidates":[{"decision":"add-local-agents","directory":"scripts","path":"scripts/AGENTS.md","priority":"P0","rationale":"scripts can mutate, generate, validate